(3-diethylamino-propyl)-carbamic acid pentyl ester; (3-Diaethylamino-propyl)-carbamidsaeure-pentylester,CCCCCOC(=O)NCCCN(CC)CC,244.378,,5000,25,Article; Shriner; Hickey; Journal of the American Chemical Society; vol. 61; (1939); p. 888;,H2O,100 g solvent dissolves. 0.5 g Substance.,GWZPAJAZTQYCPT-UHFFFAOYSA-N
(3-diethylamino-propyl)-carbamic acid isopentyl ester; (3-Diaethylamino-propyl)-carbamidsaeure-isopentylester,CCN(CC)CCCNC(=O)OCCC(C)C,244.378,,6000,25,Article; Shriner; Hickey; Journal of the American Chemical Society; vol. 61; (1939); p. 888;,H2O,100 g solvent dissolves. 0.6 g Substance.,QRXKPRKTHHCFRB-UHFFFAOYSA-N
"acetic acid-[3-(2,3-dimethyl-5-oxo-2,5-dihydro-pyrazol-1-yl)-anilide]; Essigsaeure-[3-(2,3-dimethyl-5-oxo-2,5-dihydro-pyrazol-1-yl)-anilid]",CN1N(C(=O)C=C1C)C1=CC=CC(NC(C)=O)=C1,245.281,,14000,25,Article; Michaelis; Justus Liebigs Annalen der Chemie; vol. 378; (1911); p. 319;,H2O,Solubility :1.4 percent.,ZHJOWUYJOISNDP-UHFFFAOYSA-N
2-lactoyloxy-propionic acid hexyl ester; 2-Lactoyloxy-propionsaeure-hexylester,CCCCCCOC(=O)C(C)OC(=O)C(C)O,246.304,73747-55-4,800,25,Article; Rehberg; Dixon; Journal of the American Chemical Society; vol. 74; (1952); p. 1609;,H2O,1000 g solvent dissolves. 0.8 g Substance.,GVMIXAYWPARWDD-UHFFFAOYSA-N
(-)(R)-1.2-bis-(alpha-carboxy-isopropylamino)-propane; (-)(R)-1.2-Bis-(alpha-carboxy-isopropylamino)-propan,[H][C@@](C)(CNC(C)(C)C(O)=O)NC(C)(C)C(O)=O,246.307,,20000,20,"Article; Pfeiffer; Christeleit; Chemische Berichte; vol. 71; (1938); p. 1497,1503;",H2O,Solubility :2 percent.,BGELXODQYRCVSP-SSDOTTSWSA-N
"3-chloro-4-hydroxy-benzoic acid-(2,3-dihydroxy-propyl ester); 3-Chlor-4-hydroxy-benzoesaeure-(2,3-dihydroxy-propylester)",OCC(O)COC(=O)C1=CC(Cl)=C(O)C=C1,246.647,,10000,18,"Article; Sabalitschka; Archiv der Pharmazie (Weinheim, Germany); vol. 269; (1931); p. 228,244;",H2O,Solubility :1 percent.,BPSKFYIYTLVIJU-UHFFFAOYSA-N
2-ethyl-6-iodo-phenol; 2-Aethyl-6-jod-phenol,CCC1=C(O)C(I)=CC=C1,248.063,,900,25,"Article; Suter; Schuetz; Journal of Organic Chemistry; vol. 16; (1951); p. 1117,1119;",H2O,100 g solvent dissolves. 0.09 g Substance.,LLQHYJPVIROUFO-UHFFFAOYSA-N
"4-(2,4-dioxo-chroman-3-yl)-butyric acid; 4-(2,4-Dioxo-chroman-3-yl)-buttersaeure",OC(=O)CCCC1C(=O)OC2=CC=CC=C2C1=O,248.235,,190,20,"Article; Mueller et al.; Monatshefte fuer Chemie; vol. 81; (1950); p. 174,177;",H2O,100 g solvent dissolves. 0.019 g Substance.,DQHDYRHOEGGCOE-UHFFFAOYSA-N
2-isobutyl-3-phenyl-succinic acid; alpha-Isobutyl-alpha'-phenyl-bernsteinsaeure; 4-Methyl-1-phenyl-pentan-dicarbonsaeure-(1.2); 2-Isobutyl-3-phenyl-bernsteinsaeure,CC(C)CC(C(C(O)=O)C1=CC=CC=C1)C(O)=O,250.295,,1330,25,Article; Upson; Thompson; Journal of the American Chemical Society; vol. 44; (1922); p. 182;,H2O,100 g solvent dissolves. 0.133 g Substance.,FZHHLTWTWCUMFM-UHFFFAOYSA-N
(2-bromo-heptanoyl)-urea; (alpha-Brom-oenanthoyl)-harnstoff; alpha-Brom-oenanthsaeure-ureid; (2-Brom-heptanoyl)-harnstoff,CCCCCC(Br)C(=O)NC(N)=O,251.123,,150,20,Article; Tiffeneau; Ardely; Bulletin des Sciences Pharmacologiques; vol. 28; p. 158; Chemisches Zentralblatt; vol. 92; III; (1921); p. 366;,H2O,100 g solvent dissolves. 0.015 g Substance.,BCYAWRXPCQIOGL-UHFFFAOYSA-N
DL-threo-N-benzoyl-3-methoxy-norvaline; DL-threo-N-Benzoyl-3-methoxy-norvalin,[H][C@@](CC)(OC)[C@@]([H])(NC(=O)C1=CC=CC=C1)C(O)=O,251.282,,2020,0,"Article; Izumiya; Nippon Kagaku Zasshi; vol. 72; (1951); p. 784,785; Chem.Abstr.; (1953); p. 1599;",H2O,100 g solvent dissolves. 0.202 g Substance.,MPFSPKRXBFVVDT-WDEREUQCSA-N
DL-erythro-N-benzoyl-3-methoxy-norvaline; DL-erythro-N-Benzoyl-3-methoxy-norvalin,[H][C@](CC)(OC)[C@@]([H])(NC(=O)C1=CC=CC=C1)C(O)=O,251.282,,1790,0,"Article; Izumiya; Nippon Kagaku Zasshi; vol. 72; (1951); p. 784,785; Chem.Abstr.; (1953); p. 1599;",H2O,100 g solvent dissolves. 0.179 g Substance.,MPFSPKRXBFVVDT-GHMZBOCLSA-N
3-amino-2-bromo-benzenesulfonic acid; 3-Amino-2-brom-benzolsulfonsaeure; 2-Brom-anilin-sulfonsaeure-(3),NC1=CC=CC(=C1Br)S(O)(=O)=O,252.089,,7370,8,Article; Bahlmann; Justus Liebigs Annalen der Chemie; vol. 186; (1877); p. 325;,H2O,100 g solvent dissolves. 0.737 g Substance.,APEJDYCFFUUKJF-UHFFFAOYSA-N
O-methyl-N-phenylcarbamoyl-DL-allothreonine; O-Methyl-N-phenylcarbamoyl-DL-allothreonin,[H][C@@](C)(OC)[C@]([H])(NC(=O)NC1=CC=CC=C1)C(O)=O,252.27,,2420,0,"Article; Izumiya; Nippon Kagaku Zasshi; vol. 72; (1951); p. 784,785; Chem.Abstr.; (1953); p. 1599;",H2O,Solubility :0.242 percent.,WYZJYYQHKUNCRA-WPRPVWTQSA-N
O-methyl-N-phenylcarbamoyl-DL-threonine; O-Methyl-N-phenylcarbamoyl-DL-threonin,[H][C@](C)(OC)[C@]([H])(NC(=O)NC1=CC=CC=C1)C(O)=O,252.27,,860,0,"Article; Izumiya; Nippon Kagaku Zasshi; vol. 72; (1951); p. 784,785; Chem.Abstr.; (1953); p. 1599;",H2O,Solubility :0.086 percent.,WYZJYYQHKUNCRA-SCZZXKLOSA-N
"5-hexyl-2,4-dihydroxy-benzoic acid methyl ester; 5-Hexyl-2,4-dihydroxy-benzoesaeure-methylester",CCCCCCC1=CC(C(=O)OC)=C(O)C=C1O,252.31,,10,20,"Article; Sabalitschka; Archiv der Pharmazie (Weinheim, Germany); vol. 269; (1931); p. 545,560;",H2O,Solubility :0.001 percent.,IZRCRVDQCWCNNT-UHFFFAOYSA-N
4-benzenesulfonylamino-valeric acid; 4-Benzolsulfonylamino-valeriansaeure,CC(CCC(O)=O)NS(=O)(=O)C1=CC=CC=C1,257.31,,1340.48,25,Article; Peters; Watanabe; Hoppe-Seyler's Zeitschrift fuer Physiologische Chemie; vol. 159; (1926); p. 263;,H2O,1 part(s) of substance.dissolves in:746 parts of solvent.,DWFAESOMCMZSEH-UHFFFAOYSA-N
(3-diethylamino-propyl)-carbamic acid hexyl ester; (3-Diaethylamino-propyl)-carbamidsaeure-hexylester,CCCCCCOC(=O)NCCCN(CC)CC,258.404,,2000,25,Article; Shriner; Hickey; Journal of the American Chemical Society; vol. 61; (1939); p. 888;,H2O,100 g solvent dissolves. 0.2 g Substance.,YRIMHYSRQKLNRH-UHFFFAOYSA-N
"5-butyl-dodecane-5,6-diol; alpha.alpha-Dibutyl-alpha'-n-hexyl-aethylenglykol; 5-Butyl-dodecan-5,6-diol",CCCCCCC(O)C(O)(CCCC)CCCC,258.445,,5,15,Article; Nicolle; Bulletin de la Societe Chimique de France; vol. <4>39; (1926); p. 65;,H2O,Solubility :0.0005 percent.,VBLGBQGQTJDOTM-UHFFFAOYSA-N
"3-hydroxy-4,3'-bis-hydroxymethyl-tetrahydro-[3,3']bifuryl-2,4',5'-trione; 3-Hydroxy-4,3'-bis-hydroxymethyl-tetrahydro-[3,3']bifuryl-2,4',5'-trion",OCC1COC(=O)C1(O)C1(CO)COC(=O)C1=O,260.2,,25000,0,Article; Feofilaktow; Chemische Berichte; vol. 59; (1926); p. 2766; Zhurnal Russkago Fiziko-Khimicheskago Obshchestva; vol. 58; (1926); p. 760;,H2O,100 g solvent dissolves. 2.5 g Substance.,UPSFXKOYYQKJHC-UHFFFAOYSA-N
2-lactoyloxy-propionic acid-(2-butoxy-ethyl ester); 2-Lactoyloxy-propionsaeure-(2-butoxy-aethylester),CCCCOCCOC(=O)C(C)OC(=O)C(C)O,262.303,,3800,25,Article; Rehberg; Dixon; Journal of the American Chemical Society; vol. 74; (1952); p. 1609;,H2O,1000 g solvent dissolves. 3.8 g Substance.,XZHNEHRPEBWTHJ-UHFFFAOYSA-N
"N,N-bis-(2,2-diethoxy-ethyl)-hydrazine; N,N-Bis-(2,2-diaethoxy-aethyl)-hydrazin; N.N-Diacetalyl-hydrazin",CCOC(CN(N)CC(OCC)OCC)OCC,264.365,,50000,0,"Article; Wolff; Marburg; Justus Liebigs Annalen der Chemie; vol. 363; (1908); p. 192,194;",H2O,1 part(s) of substance.dissolves in:20 parts of solvent.,GXKZOWPZYNNPGA-UHFFFAOYSA-N
"3,5-diamino-4-bromo-benzenesulfonic acid; 2-Brom-phenylen-diamin-(1.3)-sulfonsaeure-(5); 3,5-Diamino-4-brom-benzolsulfonsaeure",NC1=CC(=CC(N)=C1Br)S(O)(=O)=O,267.103,,4611,20,Article; Baessmann; Justus Liebigs Annalen der Chemie; vol. 191; (1878); p. 206;,H2O,100 g solvent dissolves. 0.4611 g Substance.,NBKGBOKVHANFHQ-UHFFFAOYSA-N
N-(4-ethoxy-phenyl)-Lg-tartramic acid; N-(4-Aethoxy-phenyl)-Lg-tartramidsaeure,[H][C@](O)(C(O)=O)[C@@]([H])(O)C(=O)NC1=CC=C(OCC)C=C1,269.254,,4000,14,Article; Casale; Gazzetta Chimica Italiana; vol. 47 II; (1917); p. 66;,H2O,100 g solvent dissolves. 0.40 g Substance.,LYWOUHRNIIBNOH-NXEZZACHSA-N
"5-bromo-1,3-dioxo-isoindoline-4-carboxylic acid; 5-Brom-1,3-dioxo-isoindolin-4-carbonsaeure",OC(=O)C1=C2C(=O)NC(=O)C2=CC=C1Br,270.039,,1470,20,"Article; Daschewskii; Petrenko; Zhurnal Obshchei Khimii; vol. 25; (1955); p. 1189,1193; engl. Ausg. S. 1139, 1141;",H2O,100 g solvent dissolves. 0.147 g Substance.,BULSDGFLPGYUTC-UHFFFAOYSA-N
(2-bromo-nonanoyl)-urea; (alpha-Brom-pelargonoyl)-harnstoff; alpha-Brom-pelargonsaeure-ureid; (2-Brom-nonanoyl)-harnstoff,CCCCCCCC(Br)C(=O)NC(N)=O,279.177,,90,20,Article; Tiffeneau; Ardely; Bulletin des Sciences Pharmacologiques; vol. 28; p. 159; Chemisches Zentralblatt; vol. 92; III; (1921); p. 366;,H2O,100 g solvent dissolves. 0.009 g Substance.,IIDSCAQXRWHEOI-UHFFFAOYSA-N
"5-cyclohexyl-5-piperidinomethyl-imidazolidine-2,4-dione; 5-Cyclohexyl-5-piperidinomethyl-imidazolidin-2,4-dion",O=C1NC(=O)C(CN2CCCCC2)(N1)C1CCCCC1,279.382,,4100,20,Patent; Cassella; US2615897; (1949);,H2O,Solubility :0.41 percent.,LDFYAYCGRKFTIY-UHFFFAOYSA-N
"8-ethoxy-7-ethoxymethyl-1,3-dimethyl-3,7-dihydro-purine-2,6-dione; 8-Aethoxy-7-aethoxymethyl-1,3-dimethyl-3,7-dihydro-purin-2,6-dion",CCOCN1C(OCC)=NC2=C1C(=O)N(C)C(=O)N2C,282.299,,,23,"Article; Fischer,E.; Ach; Chemische Berichte; vol. 39; (1906); p. 434;",H2O,1 g solvent dissolves. 1250 ml Substance.,PEPYQOCCKJUDFV-UHFFFAOYSA-N
(2-phenyl-quinoline-3-carbonyl)-urea; (2-Phenyl-chinolin-3-carbonyl)-harnstoff,NC(=O)NC(=O)C1=CC2=CC=CC=C2N=C1C1=CC=CC=C1,291.309,,175000,20,"Article; John; Journal fuer Praktische Chemie (Leipzig); vol. <2> 131; (1931); p. 314,318;",H2O,Solubility :0.15-20 percent.,ZUTKATKAOMWRFY-UHFFFAOYSA-N
"5,5'-diethyl-5,5'-dimethyl-1,1'-methanediyl-bis-imidazolidine-2,4-dione; 5,5'-Diaethyl-5,5'-dimethyl-1,1'-methandiyl-bis-imidazolidin-2,4-dion",CCC1(C)N(CN2C(=O)NC(=O)C2(C)CC)C(=O)NC1=O,296.326,75440-93-6,800,25,Patent; Du Pont de Nemours & Co.; US2417999; (1945);,H2O,Solubility :0.08 percent.,SKSBWFROMHJLHY-UHFFFAOYSA-N
2-amino-4-iodo-benzenesulfonic acid; 2-Amino-4-jod-benzolsulfonsaeure; 5-Jod-anilin-sulfonsaeure-(2),NC1=C(C=CC(I)=C1)S(O)(=O)=O,299.089,,2600,25,Article; Boyle; Journal of the Chemical Society; vol. 115; (1919); p. 1508;,H2O,100 g solvent dissolves. 0.26 g Substance.,NTGUTSHPZKTBSS-UHFFFAOYSA-N
3-amino-4-iodo-benzenesulfonic acid; 3-Amino-4-jod-benzolsulfonsaeure; 6-Jod-anilin-sulfonsaeure-(3),NC1=C(I)C=CC(=C1)S(O)(=O)=O,299.089,,4800,25,Article; Boyle; Journal of the Chemical Society; vol. 115; (1919); p. 1508;,H2O,100 g solvent dissolves. 0.48 g Substance.,HCULSWZCJQJOER-UHFFFAOYSA-N
5-amino-2-iodo-benzenesulfonic acid; 5-Amino-2-jod-benzolsulfonsaeure; 4-Jod-anilin-sulfonsaeure-(3),NC1=CC(=C(I)C=C1)S(O)(=O)=O,299.089,,13600,25,Article; Boyle; Journal of the Chemical Society; vol. 115; (1919); p. 1508;,H2O,100 g solvent dissolves. 1.36 g Substance.,HQPDDIDBXUXBDK-UHFFFAOYSA-N
3-amino-5-iodo-benzenesulfonic acid; 3-Amino-5-jod-benzolsulfonsaeure; 5-Jod-anilin-sulfonsaeure-(3),NC1=CC(I)=CC(=C1)S(O)(=O)=O,299.089,,13100,25,Article; Boyle; Journal of the Chemical Society; vol. 115; (1919); p. 1508;,H2O,100 g solvent dissolves. 1.31 g Substance.,CGCFRRXNQRHBGD-UHFFFAOYSA-N
(alpha-bromo-isovaleryl)-salicyloyl-amine; (alpha-Brom-isovaleryl)-salicyloyl-amin,CC(C)C(Br)C(=O)NC(=O)C1=C(O)C=CC=C1,300.152,,53000,20,"Article; Covello; Rendiconto dell'Accademia delle Scienze Fisiche e Matematiche, Naples; vol. <4>2; (1932); p. 73; Chemisches Zentralblatt; vol. 104; II; (1933); p. 2661;",H2O,100 g solvent dissolves. 5.3 g Substance.,GOXXTAOVEBXSFF-UHFFFAOYSA-N
"1,1,1-trichloro-2,2-bis-methanesulfonyl-propane; 1,1,1-Trichlor-2,2-bis-methansulfonyl-propan",CC(C(Cl)(Cl)Cl)(S(C)(=O)=O)S(C)(=O)=O,303.615,,250,20,"Article; Boehme et al.; Justus Liebigs Annalen der Chemie; vol. 587; (1954); p. 51,58;",H2O,4000 g solvent dissolves. 1 g Substance.,GYBQMQBMNIIPNT-UHFFFAOYSA-N
2-lactoyloxy-propionic acid-[2-(2-butoxy-ethoxy)-ethyl ester]; 2-Lactoyloxy-propionsaeure-[2-(2-butoxy-aethoxy)-aethylester],CCCCOCCOCCOC(=O)C(C)OC(=O)C(C)O,306.356,,3100,25,Article; Rehberg; Dixon; Journal of the American Chemical Society; vol. 74; (1952); p. 1609;,H2O,1000 g solvent dissolves. 3.1 g Substance.,LEHRDFVEQITILV-UHFFFAOYSA-N
arabinose-[(2-methyl-butyl)-phenyl-hydrazone]; Arabinose-[(2-methyl-butyl)-phenyl-hydrazon],CCC(C)CN(N=CC(O)C(O)C(O)CO)C1=CC=CC=C1,310.393,,200000,20,Article; Neuberg; Federer; Chemische Berichte; vol. 38; (1905); p. 874;,H2O,1 part(s) of substance.dissolves in:5 parts of solvent.; <d-arabinose>-<(d-pentyl)-phenylhydrazone>,UCMORNANELDFNU-UHFFFAOYSA-N
D-glucose-(4-phenyl semicarbazone); D-Glucose-(4-phenyl-semicarbazon),[H][C@@](O)(CO)[C@@]([H])(O)[C@]([H])(O)[C@@]([H])(O)C=NNC(=O)NC1=CC=CC=C1,313.31,,75700,20,"Article; Barre; Piche; vol. 20; (1942); p. 17,18,19;",H2O,Solubility :7.57 percent.,GCKQUKHHPWZQJB-IRCOFANPSA-N
D-glucaric acid bis-isobutylamide; D-Glucarsaeure-bis-isobutylamid; D-Zuckersaeure-bis-isobutylamid,[H][C@](O)(C(=O)NCC(C)C)[C@@]([H])(O)[C@]([H])(O)[C@]([H])(O)C(=O)NCC(C)C,320.386,,14400,24.5,Article; Kurtz; Wilson; Journal of Biological Chemistry; vol. 129; (1939); p. 695;,H2O,100 g solvent dissolves. 1.44 g Substance.,DGBUIVROPMIGTH-FIQHERPVSA-N
"2,2-bis-ethanesulfonyl-1,1,1-trichloro-propane; 2,2-Bis-aethansulfonyl-1,1,1-trichlor-propan",CCS(=O)(=O)C(C)(C(Cl)(Cl)Cl)S(=O)(=O)CC,331.669,,200,20,"Article; Boehme et al.; Justus Liebigs Annalen der Chemie; vol. 587; (1954); p. 51,58;",H2O,5000 g solvent dissolves. 1 g Substance.,NKPYBHNKCKUNRN-UHFFFAOYSA-N
4-(6-chloro-6-deoxy-beta-D-glucopyranosyloxy)-3-methoxy-benzaldehyde; 4-(6-Chlor-6-desoxy-beta-D-glucopyranosyloxy)-3-methoxy-benzaldehyd,COC1=C(O[C@@H]2O[C@H](CCl)[C@@H](O)[C@H](O)[C@H]2O)C=CC(C=O)=C1,332.738,,2800,30,"Article; Helferich et al.; Hoppe-Seyler's Zeitschrift fuer Physiologische Chemie; vol. 248; (1937); p. 85,91;",H2O,Solubility:2.8 g/kg.,IQJUMZUPKVCXOO-RKQHYHRCSA-N
decyloxyethyl beta-D-xylopyranoside; decyloxyethyl-beta-D-xylopyranoside,CCCCCCCCCCOCCO[C@@H]1OC[C@@H](O)[C@H](O)[C@H]1O,334.453,,2000,25,"Article; Shen, Wangzhen; Ji, Shanwei; Chen, Langqiu; Zhang, Yanhua; Wu, Xiubing; Journal of Surfactants and Detergents; vol. 21; 2; (2018); p. 255 - 267;",water,Solubility: 0.2 g/100g solvent,PKCAWTBTYINYTI-YYIAUSFCSA-N
"3-(1,3-dimethyl-2,6-dioxo-1,2,3,6-tetrahydro-purin-7-yl)-propionic acid-[bis-(2-hydroxy-ethyl)-amide]; 3-(1,3-Dimethyl-2,6-dioxo-1,2,3,6-tetrahydro-purin-7-yl)-propionsaeure-[bis-(2-hydroxy-aethyl)-amid]",CN1C2=C(N(CCC(=O)N(CCO)CCO)C=N2)C(=O)N(C)C1=O,339.351,,349000,20,Patent; Arzneimittelfabr.Krewel-Leuffen; DE1011888; (1955);,H2O,Solubility :34.9 percent.,NWFIMKICWZZBIL-UHFFFAOYSA-N
galactose-[(2-methyl-butyl)-phenyl-hydrazone]; Galactose-[(2-methyl-butyl)-phenyl-hydrazon],CCC(C)CN(N=CC(O)C(O)C(O)C(O)CO)C1=CC=CC=C1,340.42,,200000,20,Article; Neuberg; Federer; Chemische Berichte; vol. 38; (1905); p. 874;,H2O,1 part(s) of substance.dissolves in:5 parts of solvent.; <d-galactose>-<(d-pentyl)-phenylhydrazone>,BTVIKPZSXBPGBV-UHFFFAOYSA-N
N-(4-nitro-toluene-2-sulfonyl)-glutamic acid; N-(4-Nitro-toluol-2-sulfonyl)-glutaminsaeure,CC1=CC=C(C=C1S(=O)(=O)NC(CCC(O)=O)C(O)=O)N(=O)=O,346.318,,9803.92,12,Article; Siegfried; Hoppe-Seyler's Zeitschrift fuer Physiologische Chemie; vol. 43; (1904); p. 68;,H2O,1 part(s) of substance.dissolves in:102 parts of solvent.,FPSLJPXPJIEMLS-UHFFFAOYSA-N
D-glucaric acid bis-isopentylamide; D-Glucarsaeure-bis-isopentylamid; D-Zuckersaeure-bis-isopentylamid,[H][C@](O)(C(=O)NCCC(C)C)[C@@]([H])(O)[C@]([H])(O)[C@]([H])(O)C(=O)NCCC(C)C,348.44,,1500,24.5,Article; Kurtz; Wilson; Journal of Biological Chemistry; vol. 129; (1939); p. 695;,H2O,100 g solvent dissolves. 0.15 g Substance.,OYODMDTXVTZILG-XDQVBPFNSA-N
D-glucaric acid bis-pentylamide; D-Glucarsaeure-bis-pentylamid; D-Zuckersaeure-bis-pentylamid,[H][C@](O)(C(=O)NCCCCC)[C@@]([H])(O)[C@]([H])(O)[C@]([H])(O)C(=O)NCCCCC,348.44,,200,24.5,Article; Kurtz; Wilson; Journal of Biological Chemistry; vol. 129; (1939); p. 695;,H2O,100 g solvent dissolves. 0.02 g Substance.,YBKQKCCOWDNHQD-XDQVBPFNSA-N
"2,4,2',4'-tetraethyl-5,5'-dimethyl-1H,1'H-1,1'-ethanediyl-bis-pyrimidin-6-one; 2,4,2',4'-Tetraaethyl-5,5'-dimethyl-1H,1'H-1,1'-aethandiyl-bis-pyrimidin-6-on",CCC1=NC(CC)=C(C)C(=O)N1CCN1C(=O)C(C)=C(CC)N=C1CC,358.484,,98.04,24,"Article; v. Meyer,E.; Journal fuer Praktische Chemie (Leipzig); vol. <2> 26; (1882); p. 355,358, 360;",H2O,1 part(s) of substance.dissolves in:10200 parts of solvent.,WWCRXUSARPSDHB-UHFFFAOYSA-N
"1,1-di-p-tolyl-galactitol; 1,1-Di-p-tolyl-galactit; 1,1-Di-p-tolyl-glucit",CC1=CC=C(C=C1)C(O)(C(O)C(O)C(O)C(O)CO)C1=CC=C(C)C=C1,362.423,,3300,20,Article; Paal; Chemische Berichte; vol. 49; (1916); p. 1587;,H2O,"0.33 part(s) of substance.dissolves in:100 parts of solvent.; omega,omega-di-p-tolyl-d-sorbitol",IYCDTWNGZNKQDU-UHFFFAOYSA-N
2-benzyl-1-phenyl-gluco-1-deoxy-heptitol; 2-Benzyl-1-phenyl-galacto-1-desoxy-heptit; 2-Benzyl-1-phenyl-gluco-1-desoxy-heptit,OCC(O)C(O)C(O)C(O)C(O)(CC1=CC=CC=C1)CC1=CC=CC=C1,362.423,,400,20,Article; Paal; Chemische Berichte; vol. 49; (1916); p. 1587;,H2O,"0.04 part(s) of substance.dissolves in:100 parts of solvent.; omega,omega-dibenzyl-d-sorbitol",QEOSCXACXNFJCY-UHFFFAOYSA-N
4-(6-bromo-6-deoxy-beta-D-glucopyranosyloxy)-3-methoxy-benzaldehyde; 4-(6-Brom-6-desoxy-beta-D-glucopyranosyloxy)-3-methoxy-benzaldehyd,COC1=C(O[C@@H]2O[C@H](CBr)[C@@H](O)[C@H](O)[C@H]2O)C=CC(C=O)=C1,377.189,,2000,30,"Article; Helferich et al.; Hoppe-Seyler's Zeitschrift fuer Physiologische Chemie; vol. 248; (1937); p. 85,91;",H2O,Solubility:2 g/kg.,WMAQHTUKOVEBNY-RKQHYHRCSA-N
"N-[3-(1,1-dioxo-1lambda6-[1,2]thiazinan-2-yl)-phenyl]-beta-D-galactopyranosylamine; N-<3-Amino-phenyl>-butansultam-(1,4)-N'-beta-D-galaktosid",OC[C@H]1O[C@@H](NC2=CC(=CC=C2)N2CCCCS2(=O)=O)[C@H](O)[C@@H](O)[C@H]1O,388.442,99000-39-2,20000,25,"Article; Helferich,B. et al.; Justus Liebigs Annalen der Chemie; vol. 651; (1962); p. 17 - 29;",H2O,Solubilty: 2 weight-percent,JEWWPCYRZCTKOV-LYYZXLFJSA-N
D-glucose-[4-(4-bromo-phenyl)-semicarbazone]; D-Glucose-[4-(4-brom-phenyl)-semicarbazon],[H][C@@](O)(CO)[C@@]([H])(O)[C@]([H])(O)[C@@]([H])(O)C=NNC(=O)NC1=CC=C(Br)C=C1,392.206,,6400,20,"Article; Barre; Piche; Canadian Journal of Research, Section B: Chemical Sciences; vol. 20; (1942); p. 17,19;",H2O,100 g solvent dissolves. 0.64 g Substance.,XERSNARDCYWUPM-IRCOFANPSA-N
4-(6-iodo-6-deoxy-beta-D-glucopyranosyloxy)-3-methoxy-benzaldehyde; 4-(6-Jod-6-desoxy-beta-D-glucopyranosyloxy)-3-methoxy-benzaldehyd,COC1=C(O[C@@H]2O[C@H](CI)[C@@H](O)[C@H](O)[C@H]2O)C=CC(C=O)=C1,424.189,,1800,30,"Article; Helferich et al.; Hoppe-Seyler's Zeitschrift fuer Physiologische Chemie; vol. 248; (1937); p. 85,91;",H2O,Solubility:1.8 g/kg.,XVZIYHWCPSASJN-RKQHYHRCSA-N
"bis-(2-dipropoxyphosphoryloxy-ethyl)-ether; O,O'-Bis-dipropoxyphosphoryl-diaethylenglykol; Bis-(2-dipropoxyphosphoryloxy-aethyl)-aether",CCCOP(=O)(OCCC)OCCOCCOP(=O)(OCCC)OCCC,434.404,109598-81-4,15000,28,Patent; Celanese Corp.Am.; US2782128; (1952);,H2O,Solubility :1.5 Gew.-prozent percent.,HQOFHMGCSOWXRN-UHFFFAOYSA-N
"(+/-)-chicoric acid; O,O'-Bis-(3,4-dihydroxy-trans-cinnamoyl)-DL-weinsaeure; (+/-)-Zichoriensaeure",[H][C@](OC(=O)\C=C\C1=CC(O)=C(O)C=C1)(C(O)=O)[C@@]([H])(OC(=O)\C=C\C1=CC(O)=C(O)C=C1)C(O)=O,474.378,6537-80-0; 52248-48-3; 53797-30-1; 70831-56-0; 133520-29-3,1000,20,"Article; Scarpati; Oriente; Tetrahedron; vol. 4; (1958); p. 43,44, 45;",H2O,100 g solvent dissolves. 0.1 g Substance.,YDDGKXBLOXEEMN-IABMMNSOSA-N
N?-(1-(N-(methyl)benzylaminomethyl)-2-oxoindolin-3-ylidene)-2-(benzyloxy)benzohydrazide,CN(CN1C(=O)C(=NNC(=O)C2=C(OCC3=CC=CC=C3)C=CC=C2)C2=CC=CC=C12)CC1=CC=CC=C1,504.588,,0.76,29.99,"Article; Shakeel, Faiyaz; Haq, Nazrul; Radwan, Awwad A.; Alanazi, Fars K.; Alsarra, Ibrahim A.; Journal of Molecular Liquids; vol. 220; (2016); p. 108 - 112;",water,Solubility: 0.00015 molpercent,PVGJDQKJVMUVKC-UHFFFAOYSA-N
N?-(1-(N-(methyl)benzylaminomethyl)-2-oxoindolin-3-ylidene)-2-(benzyloxy)benzohydrazide,CN(CN1C(=O)C(=NNC(=O)C2=C(OCC3=CC=CC=C3)C=CC=C2)C2=CC=CC=C12)CC1=CC=CC=C1,504.588,,56.01,24.99,"Article; Shakeel, Faiyaz; Haq, Nazrul; Radwan, Awwad A.; Alanazi, Fars K.; Alsarra, Ibrahim A.; Journal of Molecular Liquids; vol. 220; (2016); p. 108 - 112;",water,Solubility: 0.0111 molpercent,PVGJDQKJVMUVKC-UHFFFAOYSA-N
"21-alpha(?)-D-glucopyranosyloxy-17-hydroxy-pregn-4-ene-3,20-dione; 21-alpha(?)-D-Glucopyranosyloxy-17-hydroxy-pregn-4-en-3,20-dion",[H][C@@]12CC[C@](O)(C(=O)CO[C@H]3O[C@H](CO)[C@@H](O)[C@H](O)[C@H]3O)[C@@]1(C)CC[C@@]1([H])[C@@]2([H])CCC2=CC(=O)CC[C@]12C,508.609,,300,23,"Article; Meystre; Miescher; Helvetica Chimica Acta; vol. 34; (1951); p. 2286,2288;",H2O,Solubility:0.3 g/kg.,FLHHRZUDPYYQIZ-NDZZWQBISA-N
"21-beta-D-glucopyranosyl-17-hydroxy-pregn-4-ene-3,11,20-trione; 21-beta-D-Glucopyranosyl-17-hydroxy-pregn-4-en-3,11,20-trion",[H][C@@]12CC[C@](O)(C(=O)CO[C@@H]3O[C@H](CO)[C@@H](O)[C@H](O)[C@H]3O)[C@@]1(C)CC(=O)[C@@]1([H])[C@@]2([H])CCC2=CC(=O)CC[C@]12C,522.593,,6000,23,"Article; Meystre; Miescher; Helvetica Chimica Acta; vol. 34; (1951); p. 2286,2288;",H2O,Solubility:6 g/kg.,ULXLLSQSIZARRX-VKOREYDRSA-N
3-(4-methylphenylsulfonamino)-2-methoxy-5-(4-morpholinoquinazolin-6-yl)benzamide,COC1=C(C=C(C=C1NS(=O)(=O)C1=CC=C(C)C=C1)C1=CC=C2N=CN=C(N3CCOCC3)C2=C1)C(N)=O,533.608,1404227-58-2,8652.45,24.99,"Article; Chen, Jiangang; Nan, Guanjun; Yang, Rong; Zhang, Sanqi; Bian, Xiaoli; Yang, Guangde; Journal of Molecular Liquids; vol. 204; (2015); p. 137 - 146;",water,Solubility: 1.6215 molpercent,ZQBGIAINDVONMH-UHFFFAOYSA-N
3-(4-fluorophenylsulfonamino)-2-methoxy-5-(4-morpholinoquinolin-6-yl)benzamide,COC1=C(C=C(C=C1NS(=O)(=O)C1=CC=C(F)C=C1)C1=CC=C2N=CC=C(N3CCOCC3)C2=C1)C(N)=O,536.584,1404227-75-3,3948.19,24.99,"Article; Chen, Jiangang; Nan, Guanjun; Yang, Rong; Zhang, Sanqi; Bian, Xiaoli; Yang, Guangde; Journal of Molecular Liquids; vol. 204; (2015); p. 137 - 146;",water,Solubility: 0.7358 molpercent,ADJQKZLSELSLFP-UHFFFAOYSA-N
3-(4-fluorophenylsulfonamino)-2-methoxy-5-(4-morpholinoquinazolin-6-yl)benzamide,COC1=C(C=C(C=C1NS(=O)(=O)C1=CC=C(F)C=C1)C1=CC=C2N=CN=C(N3CCOCC3)C2=C1)C(N)=O,537.571,1404227-55-9,4911.79,24.99,"Article; Chen, Jiangang; Nan, Guanjun; Yang, Rong; Zhang, Sanqi; Bian, Xiaoli; Yang, Guangde; Journal of Molecular Liquids; vol. 204; (2015); p. 137 - 146;",water,Solubility: 0.9137 molpercent,JXGKOKBJBSYWPT-UHFFFAOYSA-N
"di-tert-butyl [6-chloro-5-(2,3-dichlorophenoxy)-2-(methylthio)-1H-benzimidazol-1-yl]methyl phosphate; [6-chloro-2-methylthio-5-(2,3-dichlorophenoxy)-1H-benzimidazol-1-yl]methyl di-tert-butyl phosphate",CSC1=NC2=CC(OC3=C(Cl)C(Cl)=CC=C3)=C(Cl)C=C2N1COP(=O)(OC(C)(C)C)OC(C)(C)C,581.884,,2.6,25,"Patent; UNIVERSIDAD NACIONAL AUTONOMA DE MEXICO; CASTILLO BOCANEGRA, Rafael; FLORES RAMOS, Miguel Angel; HERNANDEZ CAMPOS, Maria Alicia; IBARRA VELARDE, Osvaldo Froylan; VERA MONTENEGRO, Remedios Yolanda; (13 pag.)US2017/327470; (2017); A1;",water,Solubility: 0.00026 g/100g solvent,DMUGFCMTPWKLCV-UHFFFAOYSA-N
"phosphoric acid tris-(2,2,2-trinitro-ethyl ester); Phosphorsaeure-tris-(2,2,2-trinitro-aethylester)",O=N(=O)C(COP(=O)(OCC(N(=O)=O)(N(=O)=O)N(=O)=O)OCC(N(=O)=O)(N(=O)=O)N(=O)=O)(N(=O)=O)N(=O)=O,587.135,,2000,20,Patent; Nitroglycerin A.B.; DE934694; (1952);,H2O,Solubility :0.2 percent.,KRIMEBLQTYNHJF-UHFFFAOYSA-N
"17beta-beta-maltosyloxy-estra-1,3,5(10)-trien-3-ol; 17beta-beta-Maltosyloxy-oestra-1,3,5(10)-trien-3-ol",[H][C@@]12CC[C@H](O[C@@H]3O[C@H](CO)[C@@H](O[C@H]4O[C@H](CO)[C@@H](O)[C@H](O)[C@H]4O)[C@H](O)[C@H]3O)[C@@]1(C)CC[C@]1([H])C3=C(CC[C@@]21[H])C=C(O)C=C3,596.672,,100,20,"Article; Meystre; Miescher; Helvetica Chimica Acta; vol. 27; (1944); p. 1153,1157;",H2O,Solubility:0.01 percent.,KMLFHOQVVJOSRN-CFAVIPICSA-N
bis-(2-carboxy-phenyl)-acetic acid; Diphenylmethan-2.2'.alpha-tricarbonsaeure; 2.2'-Dicarboxy-diphenylessigsaeure; Bis-(2-carboxy-phenyl)-essigsaeure,OC(=O)C(C1=C(C=CC=C1)C(O)=O)C1=C(C=CC=C1)C(O)=O,300.268,22589-07-7,950,25,Article; Graebe; Juillard; Justus Liebigs Annalen der Chemie; vol. 242; (1887); p. 222;,H2O,0.095 part(s) of substance.dissolves in:100 parts of solvent.,AOTLXSIYOKZSAI-UHFFFAOYSA-N
"2-(2,2-bis-ethoxycarbonyl-ethyl)-benzoic acid; 2-(2,2-Bis-aethoxycarbonyl-aethyl)-benzoesaeure; 2-Carboxy-benzylmalonsaeure-diaethylester",CCOC(=O)C(CC1=C(C=CC=C1)C(O)=O)C(=O)OCC,294.304,14746-25-9,448.43,17,Article; Wislicenus; Justus Liebigs Annalen der Chemie; vol. 242; (1887); p. 46;,H2O,1 part(s) of substance.dissolves in:2230 parts of solvent.,ZTPGRZLRJVEVLX-UHFFFAOYSA-N
"9,10-dioxo-9,10-dihydro-anthracene-1,5-disulfonic acid dianilide; 9,10-Dioxo-9,10-dihydro-anthracen-1,5-disulfonsaeure-dianilid; Anthrachinon-disulfonsaeure-(1.5)-dianilid",O=C1C2=CC=CC(=C2C(=O)C2=C1C(=CC=C2)S(=O)(=O)NC1=CC=CC=C1)S(=O)(=O)NC1=CC=CC=C1,518.571,,4000,18,"Article; Fierz-David,H.E.; Helvetica Chimica Acta; vol. 10; (1927); p. 199; Journal fuer Praktische Chemie (Leipzig); vol. <2>131; (1931); p. 374;",H2O,1 part(s) of substance.dissolves in:250 parts of solvent.,TXMPLDGCJRXQHF-UHFFFAOYSA-N
"9,10-dioxo-9,10-dihydro-anthracene-1,8-disulfonic acid dianilide; 9,10-Dioxo-9,10-dihydro-anthracen-1,8-disulfonsaeure-dianilid; Anthrachinon-disulfonsaeure-(1.8)-dianilid",O=C1C2=CC=CC(=C2C(=O)C2=C1C=CC=C2S(=O)(=O)NC1=CC=CC=C1)S(=O)(=O)NC1=CC=CC=C1,518.571,,23809.52,18,"Article; Fierz-David,H.E.; Helvetica Chimica Acta; vol. 10; (1927); p. 199; Journal fuer Praktische Chemie (Leipzig); vol. <2>131; (1931); p. 374;",H2O,1 part(s) of substance.dissolves in:42 parts of solvent.,RNBCTEHVFYBFDB-UHFFFAOYSA-N
3-(4-nitro-toluene-2-sulfonylamino)-valeric acid; 3-(4-Nitro-toluol-2-sulfonylamino)-valeriansaeure,CCC(CC(O)=O)NS(=O)(=O)C1=C(C)C=CC(=C1)N(=O)=O,316.335,,146,25,Article; Anziegin; Gulewitsch; Hoppe-Seyler's Zeitschrift fuer Physiologische Chemie; vol. 158; (1926); p. 38;,H2O,100 g solvent dissolves. 0.0146 g Substance.,SNELQFNMXNSQIU-UHFFFAOYSA-N
3-(N'-[1]naphthyl-ureido)-valeric acid; beta-[omega-(alpha-Naphthyl)-ureido]-n-valeriansaeure; 3-(N'-[1]Naphthyl-ureido)-valeriansaeure,CCC(CC(O)=O)NC(=O)NC1=CC=CC2=CC=CC=C12,286.331,,170,25,Article; Anziegin; Gulewitsch; Hoppe-Seyler's Zeitschrift fuer Physiologische Chemie; vol. 158; (1926); p. 38;,H2O,100 g solvent dissolves. 0.016-.018 g Substance.,SKNWDKOBKFQQMG-UHFFFAOYSA-N
